{
  "schema_version": "0.1",
  "id": "irlml6402trpbf",
  "manufacturer": "Infineon / International Rectifier",
  "mpn": "IRLML6402TRPBF",
  "lcsc": "C2593",
  "category": "MOSFET",
  "availability": "identity_only",
  "provenance": {
    "archive_sha256": "1e0ea256f0847ddc384259b1b90d7bb3829af448dd6ae949755f9df9d59e1447",
    "member": "eda_device_knowledge_experiment/mosfet/IRLML6402TRPBF.json",
    "identity_status": "imported_from_experiment_not_manufacturer_certification",
    "original_datasheet_url": "https://www.lcsc.com/datasheet/C2593.pdf"
  },
  "sources": {},
  "facts": [],
  "pins": [],
  "constraints": [],
  "reference_applications": [],
  "unavailable": [
    {
      "field": "facts",
      "reason": "Not retained: no exact scoped evidence confirmed, missing test conditions, or second-hand generalization.",
      "keys": [
        "channel",
        "vds_max_V",
        "id_continuous_A",
        "rds_on",
        "vgs_max_V",
        "vth_V",
        "qg_nC",
        "qgd_nC",
        "body_diode",
        "thermal"
      ]
    },
    {
      "field": "pins",
      "reason": "Original pin descriptions not reconfirmed against an exact scoped pin table."
    },
    {
      "field": "package",
      "reason": "Orderable-part package association not independently reconfirmed; do not infer a footprint from the family."
    },
    {
      "field": "schematic_rules_and_layout",
      "reason": "Original required_external/optional/recommendation prose removed; only separately cited explicit constraints are retained."
    }
  ]
}
