{
  "schema_version": "0.1",
  "id": "tps54302ddcr",
  "manufacturer": "Texas Instruments",
  "mpn": "TPS54302DDCR",
  "lcsc": "C311983",
  "category": "DC-DC",
  "availability": "scoped_facts",
  "provenance": {
    "archive_sha256": "1e0ea256f0847ddc384259b1b90d7bb3829af448dd6ae949755f9df9d59e1447",
    "member": "eda_device_knowledge_experiment/dc_dc/TPS54302DDCR.json",
    "identity_status": "imported_from_experiment_not_manufacturer_certification",
    "original_datasheet_url": "https://www.lcsc.com/datasheet/C311983.pdf"
  },
  "sources": {
    "s1": {
      "url": "https://datasheet.lcsc.com/datasheet/pdf/dd7a4984f2d3ca9a2264b937537aa471.pdf?productCode=C311983",
      "document": "TPS54302 4.5V 至28V 输入电压、3A 输出电流、EMI 友好型同步降压转换器 datasheet (Rev. A)",
      "pdf_page": 1
    }
  },
  "facts": [
    {
      "values": {
        "topology": "synchronous buck",
        "vin_V": [
          4.5,
          28.0
        ],
        "iout_max_A": 3.0,
        "switching_frequency": "~400 kHz"
      },
      "source_refs": [
        "s1"
      ]
    }
  ],
  "pins": [],
  "constraints": [],
  "reference_applications": [],
  "unavailable": [
    {
      "field": "facts",
      "reason": "Not retained: no exact scoped evidence confirmed, missing test conditions, or second-hand generalization.",
      "keys": [
        "fb_reference",
        "enable"
      ]
    },
    {
      "field": "pins",
      "reason": "Original pin descriptions not reconfirmed against an exact scoped pin table."
    },
    {
      "field": "package",
      "reason": "Orderable-part package association not independently reconfirmed; do not infer a footprint from the family."
    },
    {
      "field": "schematic_rules_and_layout",
      "reason": "Original required_external/optional/recommendation prose removed; only separately cited explicit constraints are retained."
    },
    {
      "field": "reference_applications",
      "name": "5V_3A_application",
      "reason": "Exact figure, document revision, or netlist scope not reconfirmed; not available for circuit reuse."
    }
  ]
}
