{
  "schema_version": "0.1",
  "id": "me6211c33m5g-n",
  "manufacturer": "Microne",
  "mpn": "ME6211C33M5G-N",
  "lcsc": "C82942",
  "category": "LDO",
  "availability": "scoped_facts",
  "provenance": {
    "archive_sha256": "1e0ea256f0847ddc384259b1b90d7bb3829af448dd6ae949755f9df9d59e1447",
    "member": "eda_device_knowledge_experiment/ldo/ME6211C33M5G-N.json",
    "identity_status": "imported_from_experiment_not_manufacturer_certification",
    "original_datasheet_url": "https://www.lcsc.com/datasheet/C82942.pdf"
  },
  "sources": {
    "s1": {
      "url": "https://datasheet.lcsc.com/datasheet/pdf/d15331d096a848ac81a26b001a32d4e3.pdf?productCode=C82942",
      "document": "High Speed LDO Regulators, Low ESR Cap",
      "pdf_page": 1
    }
  },
  "facts": [
    {
      "values": {
        "standby_current": "~0.1 uA",
        "enable": true
      },
      "source_refs": [
        "s1"
      ]
    }
  ],
  "pins": [],
  "constraints": [],
  "reference_applications": [],
  "unavailable": [
    {
      "field": "facts",
      "reason": "Not retained: no exact scoped evidence confirmed, missing test conditions, or second-hand generalization.",
      "keys": [
        "vin_max_V",
        "vout_V",
        "iout_max_A",
        "dropout",
        "quiescent_current",
        "stability"
      ]
    },
    {
      "field": "pins",
      "reason": "Original pin descriptions not reconfirmed against an exact scoped pin table."
    },
    {
      "field": "package",
      "reason": "Orderable-part package association not independently reconfirmed; do not infer a footprint from the family."
    },
    {
      "field": "schematic_rules_and_layout",
      "reason": "Original required_external/optional/recommendation prose removed; only separately cited explicit constraints are retained."
    },
    {
      "field": "reference_applications",
      "name": "always_on_application",
      "reason": "Exact figure, document revision, or netlist scope not reconfirmed; not available for circuit reuse."
    }
  ]
}
