{
  "schema_version": "0.1",
  "id": "ao3400a",
  "manufacturer": "Alpha & Omega Semiconductor",
  "mpn": "AO3400A",
  "lcsc": "C20917",
  "category": "MOSFET",
  "availability": "scoped_facts",
  "provenance": {
    "archive_sha256": "1e0ea256f0847ddc384259b1b90d7bb3829af448dd6ae949755f9df9d59e1447",
    "member": "eda_device_knowledge_experiment/mosfet/AO3400A.json",
    "identity_status": "imported_from_experiment_not_manufacturer_certification",
    "original_datasheet_url": "https://www.lcsc.com/datasheet/C20917.pdf"
  },
  "sources": {
    "s1": {
      "url": "https://datasheet.lcsc.com/datasheet/pdf/130876b936da464599428c58fd8de8f6.pdf?productCode=C20917",
      "document": "AO3400A Rev 3",
      "pdf_page": 1,
      "printed_page": 1
    }
  },
  "facts": [
    {
      "values": {
        "channel": "N",
        "vds_max_V": 30,
        "vgs_max_V": 12
      },
      "source_refs": [
        "s1"
      ]
    }
  ],
  "pins": [],
  "constraints": [],
  "reference_applications": [],
  "unavailable": [
    {
      "field": "facts",
      "reason": "Not retained: no exact scoped evidence confirmed, missing test conditions, or second-hand generalization.",
      "keys": [
        "id_continuous_A",
        "rds_on",
        "vth_V",
        "vth_typ_V",
        "qg_nC",
        "qgd_nC",
        "body_diode",
        "thermal"
      ]
    },
    {
      "field": "pins",
      "reason": "Original pin descriptions not reconfirmed against an exact scoped pin table."
    },
    {
      "field": "package",
      "reason": "Orderable-part package association not independently reconfirmed; do not infer a footprint from the family."
    },
    {
      "field": "schematic_rules_and_layout",
      "reason": "Original required_external/optional/recommendation prose removed; only separately cited explicit constraints are retained."
    }
  ]
}
