{
  "schema_version": "0.1",
  "id": "tlv75733pdbvr",
  "manufacturer": "Texas Instruments",
  "mpn": "TLV75733PDBVR",
  "lcsc": "C485517",
  "category": "LDO",
  "availability": "scoped_facts",
  "provenance": {
    "archive_sha256": "1e0ea256f0847ddc384259b1b90d7bb3829af448dd6ae949755f9df9d59e1447",
    "member": "eda_device_knowledge_experiment/ldo/TLV75733PDBVR.json",
    "identity_status": "imported_from_experiment_not_manufacturer_certification",
    "original_datasheet_url": "https://www.lcsc.com/datasheet/C485517.pdf"
  },
  "sources": {
    "s1": {
      "url": "https://datasheet.lcsc.com/datasheet/pdf/edd4724bddb84d5511fcf6af443cafd0.pdf?productCode=C485517",
      "document": "TLV757P 1-A, Low IQ, Small\n\t Size, Low Dropout Regulator datasheet (Rev. A)",
      "pdf_page": 1
    }
  },
  "facts": [
    {
      "values": {
        "vin_V": [
          1.45,
          5.5
        ],
        "iout_max_A": 1.0,
        "dropout": "~425 mV max at 1 A for 3.3 V option",
        "quiescent_current": "25 uA typ",
        "enable": true
      },
      "source_refs": [
        "s1"
      ]
    }
  ],
  "pins": [],
  "constraints": [],
  "reference_applications": [],
  "unavailable": [
    {
      "field": "facts",
      "reason": "Not retained: no exact scoped evidence confirmed, missing test conditions, or second-hand generalization.",
      "keys": [
        "vout_V",
        "stability"
      ]
    },
    {
      "field": "pins",
      "reason": "Original pin descriptions not reconfirmed against an exact scoped pin table."
    },
    {
      "field": "package",
      "reason": "Orderable-part package association not independently reconfirmed; do not infer a footprint from the family."
    },
    {
      "field": "schematic_rules_and_layout",
      "reason": "Original required_external/optional/recommendation prose removed; only separately cited explicit constraints are retained."
    },
    {
      "field": "reference_applications",
      "name": "basic_application",
      "reason": "Exact figure, document revision, or netlist scope not reconfirmed; not available for circuit reuse."
    }
  ]
}
