{
  "schema_version": "0.1",
  "id": "lm1117impx-3.3_nopb",
  "manufacturer": "Texas Instruments",
  "mpn": "LM1117IMPX-3.3/NOPB",
  "lcsc": "C23984",
  "category": "LDO",
  "availability": "identity_only",
  "provenance": {
    "archive_sha256": "1e0ea256f0847ddc384259b1b90d7bb3829af448dd6ae949755f9df9d59e1447",
    "member": "eda_device_knowledge_experiment/ldo/LM1117IMPX-3.3_NOPB.json",
    "identity_status": "imported_from_experiment_not_manufacturer_certification",
    "original_datasheet_url": "https://www.lcsc.com/datasheet/C23984.pdf"
  },
  "sources": {},
  "facts": [],
  "pins": [],
  "constraints": [],
  "reference_applications": [],
  "unavailable": [
    {
      "field": "facts",
      "reason": "Not retained: no exact scoped evidence confirmed, missing test conditions, or second-hand generalization.",
      "keys": [
        "vin_V",
        "vout_V",
        "iout_max_A",
        "dropout",
        "quiescent_current",
        "enable",
        "power_good",
        "stability"
      ]
    },
    {
      "field": "pins",
      "reason": "Original pin descriptions not reconfirmed against an exact scoped pin table."
    },
    {
      "field": "package",
      "reason": "Orderable-part package association not independently reconfirmed; do not infer a footprint from the family."
    },
    {
      "field": "schematic_rules_and_layout",
      "reason": "Original required_external/optional/recommendation prose removed; only separately cited explicit constraints are retained."
    }
  ]
}
