{
  "schema_version": "0.1",
  "id": "mcp73831t-2aci_ot",
  "manufacturer": "Microchip Technology",
  "mpn": "MCP73831T-2ACI/OT",
  "lcsc": "C424093",
  "category": "Battery Management",
  "availability": "scoped_facts",
  "provenance": {
    "archive_sha256": "1e0ea256f0847ddc384259b1b90d7bb3829af448dd6ae949755f9df9d59e1447",
    "member": "eda_device_knowledge_experiment/battery_management/MCP73831T-2ACI_OT.json",
    "identity_status": "imported_from_experiment_not_manufacturer_certification",
    "original_datasheet_url": "https://www.lcsc.com/datasheet/C424093.pdf"
  },
  "sources": {
    "s1": {
      "url": "https://datasheet.lcsc.com/datasheet/pdf/c7ec00710e742b7fb9393e620ae1332b.pdf?productCode=C424093",
      "document": "MCP73831/2 Data Sheet",
      "pdf_page": 1
    }
  },
  "facts": [
    {
      "values": {
        "type": "linear charger",
        "cells": 1,
        "charge_current_A": [
          0.015,
          0.5
        ],
        "status": [
          "STAT"
        ]
      },
      "source_refs": [
        "s1"
      ]
    }
  ],
  "pins": [],
  "constraints": [],
  "reference_applications": [],
  "unavailable": [
    {
      "field": "facts",
      "reason": "Not retained: no exact scoped evidence confirmed, missing test conditions, or second-hand generalization.",
      "keys": [
        "vin_V",
        "charge_voltage_V",
        "charge_current_program"
      ]
    },
    {
      "field": "pins",
      "reason": "Original pin descriptions not reconfirmed against an exact scoped pin table."
    },
    {
      "field": "package",
      "reason": "Orderable-part package association not independently reconfirmed; do not infer a footprint from the family."
    },
    {
      "field": "schematic_rules_and_layout",
      "reason": "Original required_external/optional/recommendation prose removed; only separately cited explicit constraints are retained."
    },
    {
      "field": "reference_applications",
      "name": "basic_application",
      "reason": "Exact figure, document revision, or netlist scope not reconfirmed; not available for circuit reuse."
    }
  ]
}
