{
  "schema_version": "0.1",
  "id": "ch32v003f4p6",
  "manufacturer": "WCH",
  "mpn": "CH32V003F4P6",
  "lcsc": "C5187096",
  "category": "MCU",
  "availability": "scoped_facts",
  "provenance": {
    "archive_sha256": "1e0ea256f0847ddc384259b1b90d7bb3829af448dd6ae949755f9df9d59e1447",
    "member": "eda_device_knowledge_experiment/mcu/CH32V003F4P6.json",
    "identity_status": "imported_from_experiment_not_manufacturer_certification",
    "original_datasheet_url": "https://www.lcsc.com/datasheet/C5187096.pdf"
  },
  "sources": {
    "s1": {
      "url": "https://datasheet.lcsc.com/datasheet/pdf/0ee0c77ddc50063d144978a55793d7fa.pdf?productCode=C5187096",
      "document": "CH32V003DS0 V1.8",
      "pdf_page": 1
    }
  },
  "facts": [
    {
      "values": {
        "core": "QingKe RISC-V",
        "flash_kB": 16,
        "max_clock_MHz": 48,
        "hse_MHz": [
          4,
          25
        ]
      },
      "source_refs": [
        "s1"
      ]
    }
  ],
  "pins": [],
  "constraints": [],
  "reference_applications": [],
  "unavailable": [
    {
      "field": "facts",
      "reason": "Not retained: no exact scoped evidence confirmed, missing test conditions, or second-hand generalization.",
      "keys": [
        "vdd_V",
        "debug",
        "interfaces_summary"
      ]
    },
    {
      "field": "pins",
      "reason": "Original pin descriptions not reconfirmed against an exact scoped pin table."
    },
    {
      "field": "package",
      "reason": "Orderable-part package association not independently reconfirmed; do not infer a footprint from the family."
    },
    {
      "field": "schematic_rules_and_layout",
      "reason": "Original required_external/optional/recommendation prose removed; only separately cited explicit constraints are retained."
    }
  ]
}
